<?xml version="1.0"?>                  
<!DOCTYPE scene SYSTEM "vpatScene.dtd">  
<scene description="RobotArm" >              
    <node>                                        
        <transform description="baseTrans" >            
            <matrix  m00="1.0"
                          m01="0.0"
                          m02="0.0"
                          m03="0.0"
                          m10="0.0"
                          m11="1.0"
                          m12="0.0"
                          m13="0.0"
                          m20="0.0"
                          m21="0.0"
                          m22="1.0"
                          m23="0.0"
                          m30="0.0"
                          m31="0.0"
                          m32="0.0"
                          m33="1.0"/>
        </transform>                               
        <node  >                                           
            <meshobject filename="robotarm.obj"  description="baseMesh" type = "obj"/> 
        </node >                                           
        <node>                                                    
            <joint description="arm1Joint" type="biaxial"> 
                <dof description="twistArm1Joint">                        
                    <position x="0.000" y="0.500" z="0.000"/> 
                    <axis x="0.00" y="1.00" z="0.00"/>     
                    <range min="-3.14" max="3.14"/>           
                </dof> 
                <dof description="adductArm1Joint">                        
                    <position x="0.000" y="0.500" z="0.000"/> 
                    <axis x="0.00" y="0.00" z="1.00"/>     
                    <range min="-1.05" max="1.05"/>           
                </dof>
            </joint>
            <node>                                           
                <meshobject filename="robotarm.obj"  description="arm1Mesh" type = "obj"/> 
            </node >
            <node>                                                    
                <joint description="arm2Joint" type="uniaxial"> 
                    <dof description="adductArm2Joint">                        
                        <position x="0.000" y="6.000" z="0.000"/> 
                        <axis x="0.00" y="0.00" z="1.00"/>     
                        <range min="-2.09" max="2.09"/>           
                    </dof>
                </joint>
                <node>                                           
                    <meshobject filename="robotarm.obj"  description="arm2Mesh" type = "obj"/> 
                </node >
            </node>
        </node>             
    </node>                    
</scene>
